{
  "schema_version": 1,
  "fingerprint": "aaaaaaaaaaaaaaaaaaaaaaaaaaaaaaaaaaaaaaaaaaaaaaaaaaaaaaaaaaaaaaaa",
  "phase": "security",
  "severity": "high",
  "category": "security",
  "confidence": "medium",
  "title": "Possible API credential committed",
  "description": "A string matching a provider API key pattern with high entropy was added in this change.",
  "evidence": { "kind": "code", "snippet": "const key = \"[REDACTED:24 chars]\";", "redacted": true },
  "location": { "file_path": "src/config/client.js", "line_start": 12, "line_end": 12 },
  "recommendation": "Rotate the credential and load it from server-side configuration.",
  "source": "rule",
  "rule_id": "secrets.generic-api-key",
  "provider": null,
  "model": null
}
